{
  "$schema": "https://json-schema.org/draft/2020-12/schema",
  "$id": "https://opensearch.org/migrations/schemas/migration-plan.schema.json",
  "title": "Migration Companion Plan",
  "description": "User-facing plan produced by the ~6-question interview. The empirical probe consumes this and produces a report + workflow.yaml.",
  "type": "object",
  "required": ["version", "source", "target", "scope", "mode"],
  "additionalProperties": false,
  "properties": {
    "version": {
      "type": "string",
      "const": "1.0.0"
    },
    "name": {
      "type": "string",
      "description": "Human-friendly run label. Must be RFC-1123 compatible (a-z0-9-). Max 40 chars so composite CR names fit under 253 chars.",
      "pattern": "^[a-z0-9]([a-z0-9-]*[a-z0-9])?$",
      "maxLength": 40
    },
    "source": {
      "type": "object",
      "required": ["engine", "version"],
      "additionalProperties": false,
      "properties": {
        "engine": {
          "type": "string",
          "enum": ["elasticsearch", "opensearch", "solr"]
        },
        "version": {
          "type": "string",
          "description": "Upstream version string e.g. '7.10.2', '8.11', '2.4.0', '9.3.0'. Used to select RFS source handler."
        },
        "endpoint": {
          "type": "string",
          "description": "Live HTTP(S) endpoint. Omit or leave empty for BYOS (Bring Your Own Snapshot) mode.",
          "format": "uri"
        },
        "allowInsecure": {
          "type": "boolean",
          "description": "When true, MA disables TLS cert verification against the source cluster. Dev-only.",
          "default": false
        },
        "auth": {
          "type": "object",
          "additionalProperties": false,
          "properties": {
            "mode": {"type": "string", "enum": ["none", "basic", "sigv4"]},
            "secretName": {
              "type": "string",
              "description": "Name of a k8s Secret with 'username' and 'password' keys. Required when mode=basic."
            }
          }
        },
        "snapshot": {
          "type": "object",
          "description": "Either take a fresh snapshot (live mode) or point at an existing one (BYOS).",
          "additionalProperties": false,
          "properties": {
            "repoUri": {"type": "string", "description": "s3://bucket/path to the snapshot repo root"},
            "s3Endpoint": {"type": "string", "description": "S3 endpoint URL — LocalStack in dev, omit for real AWS"},
            "awsRegion": {"type": "string"},
            "name": {
              "type": "string",
              "description": "Snapshot name. MUST be RFC-1123 (no underscores!) because MA builds CR names like source1.target1.<snapshotName>.migration-0.<stage>",
              "pattern": "^[a-z0-9]([a-z0-9-]*[a-z0-9])?$",
              "maxLength": 64
            },
            "alreadyExists": {
              "type": "boolean",
              "description": "If true -> BYOS (don't re-snapshot). If false/absent -> take one."
            },
            "indices": {
              "type": "array",
              "description": "Index patterns to include in snapshot. Defaults to ['*'].",
              "items": {"type": "string"}
            }
          }
        }
      }
    },
    "target": {
      "type": "object",
      "required": ["engine", "endpoint"],
      "additionalProperties": false,
      "properties": {
        "engine": {"type": "string", "enum": ["opensearch"]},
        "version": {"type": "string", "description": "e.g. '2.11.1', '3.5.0'"},
        "endpoint": {"type": "string", "format": "uri"},
        "allowInsecure": {"type": "boolean", "default": false},
        "auth": {
          "type": "object",
          "additionalProperties": false,
          "properties": {
            "mode": {"type": "string", "enum": ["none", "basic", "sigv4"]},
            "secretName": {"type": "string"}
          }
        }
      }
    },
    "scope": {
      "type": "object",
      "description": "What to migrate.",
      "additionalProperties": false,
      "properties": {
        "indexPatterns": {
          "type": "array",
          "description": "Glob patterns; default ['*'] excluding system (.*)",
          "items": {"type": "string"},
          "default": ["*"]
        },
        "excludePatterns": {
          "type": "array",
          "items": {"type": "string"},
          "default": [".*"]
        },
        "rfsWorkers": {
          "type": "integer",
          "description": "Reindex-From-Snapshot worker pod replicas.",
          "minimum": 1,
          "maximum": 64,
          "default": 1
        }
      }
    },
    "mode": {
      "type": "string",
      "enum": ["full-backfill", "metadata-only"],
      "default": "full-backfill",
      "description": "v1 supports backfill + metadata. Live-capture (Kafka/proxy/replayer) is deferred."
    },
    "gates": {
      "type": "object",
      "description": "How to handle MA ApprovalGates (evaluatemetadata / migratemetadata / vapretry).",
      "additionalProperties": false,
      "properties": {
        "autoApprove": {
          "type": "boolean",
          "default": false,
          "description": "If true, companion patches phase=Approved as soon as gate enters Initialized. If false, user is prompted per gate."
        }
      }
    },
    "empirical": {
      "type": "object",
      "description": "Pre-production dry-run settings.",
      "additionalProperties": false,
      "properties": {
        "enabled": {"type": "boolean", "default": true},
        "kubeconfig": {"type": "string"},
        "namespace": {"type": "string", "default": "ma"},
        "sampleSize": {
          "type": "integer",
          "description": "Max docs per index to migrate in the dry-run. 0 = all.",
          "default": 1000
        }
      }
    }
  }
}
